file_path,title,description
mp4_files/narrate00.mp4,narrate00.mp4,"Larry remains optimistic about the future and carries the lessons learned and cherished memories with him always.

This text is a personal reflection by Larry Law, a Chinese-Vietnamese immigrant, on his journey in the restaurant business. He shares his experiences during the Vietnam War and expresses gratitude for the connections he has made and the joy of serving others. Despite the ups and downs and challenges of running a restaurant, Larry values the camaraderie with his staff and the satisfaction of seeing customers' smiles. He takes pride in his restaurant's success and the contributions of his partners and staff. Recently, his restaurant has relocated, but Larry remains optimistic about the future and carries the lessons learned and cherished memories with him always. He has encountered remarkable individuals along his journey, including politicians and iconic figures, and is forever grateful for the opportunities this journey has afforded him."
mp4_files/narrate0.mp4,narrate0.mp4,"Overall, Larry's story is one of resilience, appreciation for diversity, and a passion for sharing his cultural heritage through food."
mp4_files/narrate7.mp4,narrate7.mp4,"Overall, the text highlights Larry's passion, determination, and appreciation for the restaurant industry and the opportunities it has provided him."
mp4_files/narrate12.mp4,narrate12.mp4,"He also shares his daughter's involvement in politics and the inspiration he derives from her work with Speaker Nancy Pelosi. Overall, Larry's personal reflection highlights the importance of connections, kindness, and sharing success with others in his journey."
